{
  "container_env": {},
  "effective_engine": {
    "adaptive_mtp": {"k": [2, 4, 5], "max_tokens": 5, "window": 32},
    "allocator": {"budget": "none", "profile_drafter_cap": 0, "scope": "none"},
    "async_scheduling": true,
    "attention_backend": "B12X_MLA_SPARSE",
    "dcp_communication": "none",
    "dcp_kv_interleave": 0,
    "decode_context_parallel_size": 1,
    "decode_prefill_tokens": 1024,
    "enable_prefix_caching": true,
    "fuse_gemm_comms": false,
    "graph_capture_sizes": [6, 12, 18, 24],
    "graph_mode": "FULL",
    "kv_cache_bytes_per_rank": 10232320000,
    "kv_cache_dtype": "nvfp4_ds_mla",
    "max_model_len": 320000,
    "max_num_batched_tokens": 2048,
    "max_num_seqs": 4,
    "moe_backend": "marlin",
    "pipeline_parallel_size": 1,
    "prefill_context_parallel_size": 1,
    "sidecar_required": true,
    "tensor_parallel_size": 4
  },
  "host_actions": {
    "boot_cpuset": null,
    "post_health_cpuset": "5-9,15-19",
    "post_health_memory_node": "0",
    "rollback_cpuset": "0-19",
    "rollback_memory_node": "0"
  },
  "model": {
    "checkpoint_identity": "glm52-dfi-hybrid-corrected-v4-lmheadw8v2",
    "checkpoint_lock": "models/checkpoint.lock.json",
    "integrity_status": "unknown",
    "rights_status": "unknown",
    "sidecar_identity": "lmhead_w8v2_sidecar.safetensors",
    "sidecar_lock": "models/sidecar.lock.json"
  },
  "name": "fast-320k",
  "profile": "fast",
  "schema_version": "1.0.0"
}
